<?xml version="1.0" encoding="UTF-8"?>
<QuanLyNhanVien xmlns:xsi="http://www.w3.org/2001/XMLSchema-instance" xsi:noNamespaceSchemaLocation="file:/D:/Projects/BaiTapXML/Do-An-XML/data/QuanLyNhanVienSchema.xsd">
    <NhanVien>
        <MaNV>MaNV0</MaNV>
        <TenNV>Trần Hoàng Anh</TenNV>
        <DiaChi>61/8, ĐTN, VP, Nha Trang, Khánh Hòa, Việt Nam, Trái Đất, Vũ trụ 7</DiaChi>
        <NgaySinh>1998-08-28</NgaySinh>
        <GioiTinh>Nam</GioiTinh>
        <DanToc>Kinh</DanToc>
        <TonGiao>Không</TonGiao>
        <CMND>123456789</CMND>
        <MaPB>MaPB0</MaPB>
        <MaCV>MaCV0</MaCV>
        <MaHDLD>MaHDLD0</MaHDLD>
    </NhanVien>
    <NhanVien>
        <MaNV>MaNV1</MaNV>
        <TenNV>Trần Hoàng Em</TenNV>
        <DiaChi>61/8, ĐTN, VP, Nha Trang, Khánh Hòa, Việt Nam, Trái Đất, Vũ trụ 1</DiaChi>
        <NgaySinh>1998-08-27</NgaySinh>
        <GioiTinh>Nam</GioiTinh>
        <DanToc>Kinh</DanToc>
        <TonGiao>Không</TonGiao>
        <CMND>987654321</CMND>
        <MaPB>MaPB1</MaPB>
        <MaCV>MaCV1</MaCV>
        <MaHDLD>MaHDLD1</MaHDLD>
    </NhanVien>
    <PhongBan>
        <MaPB>MaPB0</MaPB>
        <TenPB>Phòng kế toán</TenPB>
    </PhongBan>
    <PhongBan>
        <MaPB>MaPB1</MaPB>
        <TenPB>Phòng hành chính</TenPB>
    </PhongBan>
    <ChucVu>
        <MaCV>MaCV0</MaCV>
        <TenCV>Nhân viên</TenCV>
        <PhuCap>0</PhuCap>
    </ChucVu>
    <ChucVu>
        <MaCV>MaCV1</MaCV>
        <TenCV>Quản lý</TenCV>
        <PhuCap>600000</PhuCap>
    </ChucVu>
    <HDLD>
        <MaHDLD>MaHDLD0</MaHDLD>
        <NgayBatDau>20010-05-04</NgayBatDau>
        <NgayKetThuc>20011-05-04</NgayKetThuc>
        <HeSoLuong>2.5</HeSoLuong>
    </HDLD>
    <HDLD>
        <MaHDLD>MaHDLD1</MaHDLD>
        <NgayBatDau>2006-05-04</NgayBatDau>
        <NgayKetThuc>20012-05-04</NgayKetThuc>
        <HeSoLuong>2.34</HeSoLuong>
    </HDLD>
<NhanVien><MaNV>0.3614820247466728</MaNV><TenNV>Hoang Cha</TenNV><DiaChi>61/8 Đoàn Trần Nghiệp</DiaChi><NgaySinh>2019-04-25</NgaySinh><GioiTinh>Nam</GioiTinh><DanToc>Hoàng</DanToc><TonGiao>Phật</TonGiao><CMND>2223</CMND><MaPB>MaPB0</MaPB><MaCV>MaCV1</MaCV><MaHDLD>0.8360003236254396</MaHDLD></NhanVien><HDLD><MaHDLD>0.8360003236254396</MaHDLD><NgayBatDau>2018-08-06</NgayBatDau><NgayKetThuc>2019-09-16</NgayKetThuc><HeSoLuong>100</HeSoLuong></HDLD></QuanLyNhanVien>